{
  "allocation": {
    "entries": [],
    "lock_groups": [],
    "solver_version": "ga019-trivial-1"
  },
  "artifact": "intent_01_sensor_node",
  "bindings": {
    "mcu": "U2",
    "reg": "U1",
    "sensor_a": "U3",
    "sensor_b": "U4",
    "supply": "PS1"
  },
  "bound_parts": {
    "mcu": [
      {
        "chosen_by": "solver",
        "part": "MCU-I2C",
        "refdes": "U2"
      }
    ],
    "reg": [
      {
        "chosen_by": "solver",
        "part": "LDO-5-3.3V",
        "refdes": "U1"
      }
    ],
    "sensor_a": [
      {
        "chosen_by": "solver",
        "part": "TMP-I2C",
        "refdes": "U3"
      }
    ],
    "sensor_b": [
      {
        "chosen_by": "solver",
        "part": "TMP-I2C",
        "refdes": "U4"
      }
    ],
    "supply": [
      {
        "chosen_by": "solver",
        "part": "SRC-5V",
        "refdes": "PS1"
      }
    ]
  },
  "connector_pinout": [],
  "escalations": [],
  "path": "records",
  "pool_spares": {},
  "resolutions": {
    "mcu.pwr": "rail:+3V3",
    "reg.vin": "rail:VBUS",
    "sensor_a.i2c": "bus:I2C0",
    "sensor_a.pwr": "rail:+3V3",
    "sensor_b.i2c": "bus:I2C0",
    "sensor_b.pwr": "rail:+3V3"
  },
  "series": "A",
  "solver_version": "ga019-trivial-1",
  "stamp": {
    "locks": {},
    "series": "A"
  }
}
